{
  "scope": "SINGLE_DB",
  "source_location": "ON_PREM",
  "source_version": "ORA_23AI_26AI",
  "topology": "SINGLE_INSTANCE",
  "edition": "NOT_SURE",
  "character_set": "AL32UTF8",
  "intent": "MIGRATE_NOW",
  "driver": "ORACLE_LICENSE_COST",
  "management_model": "MANAGED_PAAS",
  "app_changeability": "APP_LIMITED",
  "compliance": "EU_DATA_BOUNDARY",
  "region": "swedencentral",
  "preview_acceptable": "PREVIEW_REFUSED",
  "cmk_required": "CMK_NO",
  "largest_db_size": "UNDER_1_TB",
  "peak_io": "UNDER_20K_IOPS",
  "peak_compute": "UP_TO_96_VCORES",
  "availability_target": "HIGH_99_95",
  "dr_requirement": "ASYNC_CROSS_REGION",
  "app_tier_oracle": "NONE_CONFIRMED",
  "downtime": "MINIMAL",
  "network_bandwidth": "GOOD_BANDWIDTH",
  "private_connectivity": "PRIVATE_LINK_READY",
  "converter_prereqs": "FOUNDRY_AND_COPILOT_READY",
  "evidence": ["SCHEMA_SCAN", "VSCODE_DISCOVERY"]
}
